{
  "schema_version": 1,
  "scenario_id": "payment-incident-shift-handoff",
  "run_id": "payment-incident-shift-handoff-20260819T080134Z",
  "state": "accepted",
  "source_identity": {
    "demo_commit": "8c9e714e90bfbdbd26c3cf7dfd6451b4ba3a9520",
    "plugin_commit": "f1eab7316b35e2ea632be4f0d7a45738319246a7",
    "harness_commit": "99f6f02fecdb7dff40c3fbc9470f5907c29f74ca",
    "cortrix_commit": "4c0f0f96b652d5662a66d047771826a4d2933739",
    "cortrix_image_digest": "sha256:f5dbb6ed129acb584e909d81d00e8cf45fbaf1b14419fb59a32784bfda11f490",
    "fixture_manifest_sha256": "c2061d4bf2e0133bc86f9d088501b6a35e3306a3235cdc19972884309f3396c2",
    "assertion_contract_sha256": "b9a93766f4167b60fdce2daafd53ed6ecfb760ae97abb8e358b09619abcb20d3",
    "answer_prompt_template_sha256": "dc33d14ccc9e2376534415084ec50b8f13361f06ea81aaf3e9860e707a42f636"
  },
  "comparison": {
    "same_harness": true,
    "same_model": true,
    "same_prompt": true,
    "same_corpus": true,
    "same_non_cortrix_tools": true,
    "only_independent_variable": "cortrix_bundle_loaded"
  },
  "provider": {
    "provider": "deepseek",
    "model": "deepseek-v4-flash",
    "local_generative_llm": false,
    "fallback_used": false,
    "secret_source": "default_profile",
    "secret_value_recorded": false
  },
  "usage": {
    "visibility": "partial",
    "observable_calls": 9,
    "observable_input_tokens": 46200,
    "observable_output_tokens": 3337,
    "observable_cache_hit_tokens": 0,
    "observable_cost_usd": 0.00740236,
    "reviewed_bound_usd": 0.15139936,
    "budget_usd": 5.0
  },
  "pricing_snapshot": {
    "schema_version": 1,
    "observed_at": "2026-08-19T06:32:01Z",
    "official_url": "https://api-docs.deepseek.com/quick_start/pricing",
    "provider": "deepseek",
    "model": "deepseek-v4-flash",
    "model_version": "DeepSeek-V4-Flash",
    "currency": "USD",
    "unit": "per_million_tokens",
    "prices_per_million_tokens": {
      "input_cache_hit": 0.0028,
      "input_cache_miss": 0.14,
      "output": 0.28
    },
    "notes": "Recorded from the official pricing page immediately before an authorized local walkthrough. A price change does not expand the repository budget."
  },
  "run_a": {
    "path": "run-a/summary.json",
    "sha256": "fd1eec3383412974bc0c991c40fdb9752f8e78898abf2edad61668211813fca7",
    "pass": true,
    "backend_mode": "cortrix_bundle_absent",
    "answer_prompt_sha256": "444ab7dbba168a0e7dd0d7a42aad5ee00a78b48a08c6c8bf140ce8eea7f33353"
  },
  "run_b": {
    "path": "run-b/summary.json",
    "sha256": "77cb3d6c00bf735837cd6e5acde2ac8e0b63049dd806d76ebaf03ebdfa00878a",
    "pass": true,
    "backend_mode": "cortrix_bundle_loaded",
    "answer_prompt_sha256": "5b831c437762ed1d0642140afcd421afb9f13f2d15f7dda6f8fa24d6f10e4eb9"
  },
  "resolver": {
    "path": "run-b/resolver.json",
    "sha256": "c20cb9d172d81e32e58928f734e9fceb7fd7d6d34906625f232480fd538f339d",
    "pass": true
  },
  "cleanup": {
    "path": "cleanup.json",
    "sha256": "279f8f0f1009f4fcb8668a6b0889561802d52a68a75bdd5178c725ad427289a4",
    "pass": true
  },
  "screenshot_eligible": true,
  "human_review_required": false,
  "negative_result": false,
  "post_screenshot_human_review_required": true,
  "acceptance": {
    "method": "independent_clean_room",
    "review_id": "REVIEW-PAYMENT-INCIDENT-HANDOFF-20260819T080556Z",
    "verdict": "pass",
    "accepted_at": "2026-08-19T08:06:37.763949+00:00",
    "acceptance_tooling_commit": "8c9e714e90bfbdbd26c3cf7dfd6451b4ba3a9520",
    "private_review_reference_recorded": false
  },
  "screenshots": [
    {
      "file": "screenshots/payment-incident-shift-handoff-desktop.png",
      "sha256": "26957012dfc30324a216266998387d1d6745ea15981ee5c15f1795476b7c7c1e",
      "width": 1440,
      "height": 1000,
      "route": "/packages/viewer/harness.html?scenario=payment-incident-shift-handoff",
      "evidence_path": "run-b/evidence-01.json"
    },
    {
      "file": "screenshots/payment-incident-shift-handoff-full-page.png",
      "sha256": "065ab98d4b72c5354d9adfdab2ed43ed78b66fe30fc6d8f6613213e78d8606da",
      "width": 1200,
      "height": 4000,
      "route": "/packages/viewer/harness.html?scenario=payment-incident-shift-handoff",
      "evidence_path": "run-b/summary.json"
    },
    {
      "file": "screenshots/payment-incident-shift-handoff-mobile.png",
      "sha256": "4b8b02554c6cfac1ced45c76aabc550aa8735de7235ab7fe4d59719f214e4db4",
      "width": 800,
      "height": 1100,
      "route": "/packages/viewer/harness.html?scenario=payment-incident-shift-handoff",
      "evidence_path": "run-b/resolver.json"
    }
  ]
}
